{
  "id": "DLA-3623-1",
  "modified": "2025-10-13T15:48:05.749899Z",
  "published": "2023-08-14T00:00:00Z",
  "upstream": [
    "CVE-2022-39189", "CVE-2022-4269", "CVE-2023-1206", "CVE-2023-1380",
    "CVE-2023-2002", "CVE-2023-2007", "CVE-2023-20588", "CVE-2023-2124",
    "CVE-2023-21255", "CVE-2023-21400", "CVE-2023-2269", "CVE-2023-2898",
    "CVE-2023-3090", "CVE-2023-31084", "CVE-2023-3111", "CVE-2023-3141",
    "CVE-2023-3212", "CVE-2023-3268", "CVE-2023-3338", "CVE-2023-3389",
    "CVE-2023-34256", "CVE-2023-34319", "CVE-2023-35788",
    "CVE-2023-35823", "CVE-2023-35824", "CVE-2023-3609", "CVE-2023-3611",
    "CVE-2023-3772", "CVE-2023-3773", "CVE-2023-3776", "CVE-2023-3863",
    "CVE-2023-4004", "CVE-2023-40283", "CVE-2023-4132", "CVE-2023-4147",
    "CVE-2023-4194", "CVE-2023-4244", "CVE-2023-4273", "CVE-2023-42753",
    "CVE-2023-42755", "CVE-2023-42756", "CVE-2023-4622", "CVE-2023-4623",
    "CVE-2023-4921"
  ],
  "affected": []
}
