{
  "id": "USN-6332-1",
  "modified": "2025-10-13T15:48:05.810314Z",
  "published": "2023-08-14T00:00:00Z",
  "upstream": [
    "CVE-2022-40982", "CVE-2022-4269", "CVE-2022-48502", "CVE-2023-0597",
    "CVE-2023-1611", "CVE-2023-1855", "CVE-2023-1990", "CVE-2023-2002",
    "CVE-2023-20593", "CVE-2023-2124", "CVE-2023-21400", "CVE-2023-2163",
    "CVE-2023-2194", "CVE-2023-2235", "CVE-2023-2269", "CVE-2023-23004",
    "CVE-2023-28466", "CVE-2023-30772", "CVE-2023-3141", "CVE-2023-32248",
    "CVE-2023-3268", "CVE-2023-33203", "CVE-2023-33288", "CVE-2023-35823",
    "CVE-2023-35824", "CVE-2023-35828", "CVE-2023-35829", "CVE-2023-3609",
    "CVE-2023-3610", "CVE-2023-3611", "CVE-2023-3776", "CVE-2023-3777",
    "CVE-2023-4004", "CVE-2023-4015", "UBUNTU-CVE-2022-40982",
    "UBUNTU-CVE-2022-4269", "UBUNTU-CVE-2022-48502",
    "UBUNTU-CVE-2023-0597", "UBUNTU-CVE-2023-1611",
    "UBUNTU-CVE-2023-1855", "UBUNTU-CVE-2023-1990",
    "UBUNTU-CVE-2023-2002", "UBUNTU-CVE-2023-20593",
    "UBUNTU-CVE-2023-2124", "UBUNTU-CVE-2023-21400",
    "UBUNTU-CVE-2023-2163", "UBUNTU-CVE-2023-2194",
    "UBUNTU-CVE-2023-2235", "UBUNTU-CVE-2023-2269",
    "UBUNTU-CVE-2023-23004", "UBUNTU-CVE-2023-28466",
    "UBUNTU-CVE-2023-30772", "UBUNTU-CVE-2023-3141",
    "UBUNTU-CVE-2023-32248", "UBUNTU-CVE-2023-3268",
    "UBUNTU-CVE-2023-33203", "UBUNTU-CVE-2023-33288",
    "UBUNTU-CVE-2023-35823", "UBUNTU-CVE-2023-35824",
    "UBUNTU-CVE-2023-35828", "UBUNTU-CVE-2023-35829",
    "UBUNTU-CVE-2023-3609", "UBUNTU-CVE-2023-3610",
    "UBUNTU-CVE-2023-3611", "UBUNTU-CVE-2023-3776",
    "UBUNTU-CVE-2023-3777", "UBUNTU-CVE-2023-4004", "UBUNTU-CVE-2023-4015"
  ],
  "affected": []
}
