{
  "affected": [
    {
      "ranges": [
        {
          "database_specific": {
            "source": "AFFECTED_FIELD",
            "versions": [
              {
                "introduced": "0"
              },
              {
                "fixed": "2.0.0-next.193"
              }
            ]
          },
          "events": [
            {
              "introduced": "0"
            },
            {
              "fixed": "eeda4f90af57368584fa97250cbb0d5bf0a5e16e"
            }
          ],
          "repo": "https://github.com/lobehub/lobehub",
          "type": "GIT"
        }
      ]
    }
  ],
  "aliases": [
    "GHSA-j7xp-4mg9-x28r"
  ],
  "database_specific": {
    "cna_assigner": "GitHub_M",
    "cwe_ids": [
      "CWE-284",
      "CWE-639",
      "CWE-862",
      "CWE-915"
    ],
    "osv_generated_from": "unknown"
  },
  "details": "LobeChat is an open source chat application platform. Prior to version 2.0.0-next.193, `knowledgeBase.removeFilesFromKnowledgeBase` tRPC ep allows authenticated users to delete files from any knowledge base without verifying ownership. `userId` filter in the database query is commented out, so it's enabling attackers to delete other users' KB files if they know the knowledge base ID and file ID. While the vulnerability is confirmed, practical exploitation requires knowing target's KB ID and target's file ID. These IDs are random and not easily enumerable. However, IDs may leak through shared links, logs, referrer headers and so on. Missing authorization check is a critical security flaw regardless. Users should upgrade to version 2.0.0-next.193 to receive a patch.",
  "id": "CVE-2026-23522",
  "modified": "2026-01-20T21:35:39.441Z",
  "published": "2026-01-19T16:53:32.371Z",
  "references": [
    {
      "type": "FIX",
      "url": "https://github.com/lobehub/lobe-chat/commit/2c1762b85acb84467ed5e799afe1499cd2f912e6"
    },
    {
      "type": "ADVISORY",
      "url": "https://github.com/lobehub/lobe-chat/security/advisories/GHSA-j7xp-4mg9-x28r"
    },
    {
      "type": "ADVISORY",
      "url": "https://nvd.nist.gov/vuln/detail/CVE-2026-23522"
    }
  ],
  "schema_version": "1.7.3",
  "severity": [
    {
      "score": "CVSS:3.1/AV:N/AC:H/PR:N/UI:N/S:U/C:N/I:L/A:N",
      "type": "CVSS_V3"
    }
  ],
  "summary": "Lobe Chat has IDOR in Knowledge Base File Removal that Allows Cross User File Deletion"
}