{
  "id": "CVE-2023-1234",
  "modified": "2023-01-02T12:00:00Z",
  "published": "2023-01-01T09:00:00Z",
  "affected": [
    {
      "ranges": [
        {
          "type": "GIT",
          "repo": "https://example.com/repo/a",
          "events": [
            { "introduced": "1.0.0" },
            { "fixed": "1.0.2" }
          ]
        }
      ]
    }
  ],
  "references": [
    {
      "type": "WEB",
      "url": "https://example.com/advisory/nvd"
    }
  ],
  "aliases": ["GHS-5678"]
}