{
  "affected": [
    {}
  ],
  "database_specific": {
    "cna_assigner": "redhat",
    "cwe_ids": [
      "CWE-415"
    ],
    "osv_generated_from": "unknown",
    "unresolved_ranges": [
      {
        "metadata": {
          "source": "AFFECTED_FIELD"
        },
        "versions": [
          {
            "last_affected": "0.1.0"
          }
        ]
      }
    ]
  },
  "details": "A double-free vulnerability was found in libdwarf. In a multiply-corrupted DWARF object, libdwarf may try to dealloc(free) an allocation twice, potentially causing unpredictable and various results.",
  "id": "CVE-2024-2002",
  "modified": "2025-11-20T18:21:28.745Z",
  "published": "2024-03-18T12:26:31.386Z",
  "references": [
    {
      "type": "WEB",
      "url": "https://access.redhat.com/downloads/content/package-browser/"
    },
    {
      "type": "ADVISORY",
      "url": "https://access.redhat.com/security/cve/CVE-2024-2002"
    },
    {
      "type": "REPORT",
      "url": "https://bugzilla.redhat.com/show_bug.cgi?id=2267700"
    },
    {
      "type": "WEB",
      "url": "https://github.com/davea42/libdwarf-code/"
    },
    {
      "type": "WEB",
      "url": "https://github.com/davea42/libdwarf-code/blob/main/bugxml/data.txt"
    },
    {
      "type": "WEB",
      "url": "https://lists.fedoraproject.org/archives/list/package-announce@lists.fedoraproject.org/message/ZGPVLSPIXR32J6FOAFTTIMYTUUXJICGW/"
    },
    {
      "type": "ADVISORY",
      "url": "https://nvd.nist.gov/vuln/detail/CVE-2024-2002"
    }
  ],
  "schema_version": "1.7.3",
  "severity": [
    {
      "score": "CVSS:3.1/AV:N/AC:L/PR:N/UI:N/S:U/C:N/I:N/A:H",
      "type": "CVSS_V3"
    }
  ],
  "summary": "Libdwarf: crashes randomly on fuzzed object"
}