{
  "id": "USN-6332-1",
  "modified": "2025-10-13T15:48:05.810314Z",
  "published": "2023-08-14T00:00:00Z",
  "upstream": [
    "UBUNTU-CVE-2023-21400",
    "UBUNTU-CVE-2023-4004",
    "UBUNTU-CVE-2023-4015",
    "CVE-2023-21400",
    "CVE-2023-4004",
    "CVE-2023-4015"
  ],
  "affected": [],
  "related": [
    "USN-6315-1",
    "USN-6325-1",
    "USN-6330-1",
    "USN-6348-1"
  ]
}
