{
  "affected": [
    {}
  ],
  "database_specific": {
    "cna_assigner": "mitre",
    "osv_generated_from": "unknown"
  },
  "details": "FFmpeg 2.x allows remote attackers to conduct cross-origin attacks and read arbitrary files by using the concat protocol in an HTTP Live Streaming (HLS) M3U8 file, leading to an external HTTP request in which the URL string contains the first line of a local file.",
  "id": "CVE-2016-1897",
  "modified": "2024-08-05T23:10:39.912Z",
  "published": "2016-01-15T02:00:00Z",
  "references": [
    {
      "type": "ARTICLE",
      "url": "http://habrahabr.ru/company/mailru/blog/274855"
    },
    {
      "type": "ADVISORY",
      "url": "http://lists.opensuse.org/opensuse-security-announce/2016-01/msg00034.html"
    },
    {
      "type": "WEB",
      "url": "http://security.stackexchange.com/questions/110644"
    },
    {
      "type": "ADVISORY",
      "url": "http://www.debian.org/security/2016/dsa-3506"
    },
    {
      "type": "ARTICLE",
      "url": "http://www.openwall.com/lists/oss-security/2016/01/14/1"
    },
    {
      "type": "ADVISORY",
      "url": "http://www.securityfocus.com/bid/80501"
    },
    {
      "type": "ADVISORY",
      "url": "http://www.securitytracker.com/id/1034932"
    },
    {
      "type": "ADVISORY",
      "url": "http://www.slackware.com/security/viewer.php?l=slackware-security\u0026y=2016\u0026m=slackware-security.529036"
    },
    {
      "type": "ADVISORY",
      "url": "http://www.ubuntu.com/usn/USN-2944-1"
    },
    {
      "type": "ADVISORY",
      "url": "https://nvd.nist.gov/vuln/detail/CVE-2016-1897"
    },
    {
      "type": "ADVISORY",
      "url": "https://security.gentoo.org/glsa/201606-09"
    },
    {
      "type": "ADVISORY",
      "url": "https://security.gentoo.org/glsa/201705-08"
    },
    {
      "type": "ADVISORY",
      "url": "https://www.kb.cert.org/vuls/id/772447"
    }
  ],
  "schema_version": "1.7.3"
}