{
  "affected": [
    {}
  ],
  "database_specific": {
    "cna_assigner": "redhat",
    "cwe_ids": [
      "CWE-200"
    ],
    "osv_generated_from": "unknown",
    "unresolved_ranges": [
      {
        "metadata": {
          "source": "AFFECTED_FIELD"
        },
        "versions": [
          {
            "last_affected": "11 and 12"
          }
        ]
      }
    ]
  },
  "details": "A flaw was found in RHDS 11 and RHDS 12. While browsing entries LDAP tries to decode the userPassword attribute instead of the userCertificate attribute which could lead into sensitive information leaked. An attacker with a local account where the cockpit-389-ds is running can list the processes and display the hashed passwords. The highest threat from this vulnerability is to data confidentiality.",
  "id": "CVE-2023-1055",
  "modified": "2025-03-11T14:02:59.854Z",
  "published": "2023-02-27T00:00:00Z",
  "references": [
    {
      "type": "REPORT",
      "url": "https://bugzilla.redhat.com/show_bug.cgi?id=2173517#c0"
    },
    {
      "type": "ADVISORY",
      "url": "https://lists.fedoraproject.org/archives/list/package-announce%40lists.fedoraproject.org/message/MZOYQ5TCV6ZEPMDV4CSLK3KINAAO4SRI/"
    },
    {
      "type": "ADVISORY",
      "url": "https://nvd.nist.gov/vuln/detail/CVE-2023-1055"
    }
  ],
  "schema_version": "1.7.3"
}