{"id": "OSV-2017-134", "summary": "Heap-buffer-overflow in cdf_file_property_info", "details": "OSS-Fuzz report: https://bugs.chromium.org/p/oss-fuzz/issues/detail?id=1064\n\nCrash type: Heap-buffer-overflow READ 1\nCrash state:\ncdf_file_property_info\ncdf_file_summary_info\ncdf_check_summary_info\n", "modified": "2021-01-01T00:00:00Z", "published": "2021-01-15T00:00:24.559102Z", "references": [{"type": "REPORT", "url": "https://bugs.chromium.org/p/oss-fuzz/issues/detail?id=1064"}], "affected": [{"package": {"name": "file", "ecosystem": "OSS-Fuzz", "purl": "pkg:generic/file"}, "ranges": [{"type": "GIT", "repo": "https://github.com/file/file.git", "events": [{"introduced": "17ee4cf670c363de8d2ea4a4897d7a699837873f"}, {"fixed": "19ccebafb7663c422c714e0c67fa4775abf91c43"}]}], "versions": ["FILE5_29", "FILE5_30"], "ecosystem_specific": {"severity": "MEDIUM"}}]}