{
  "id": "TEST-2026-21",
  "published": "2026-01-02T00:00:00Z",
  "modified": "2026-01-02T00:00:00Z",
  "summary": "A vulnerability",
  "details": "Blah blah blah\nBlah\n",
  "affected": [
    {
      "package": {
        "name": "blah.com/package",
        "ecosystem": "Go"
      },
      "ranges": [
        {
          "type": "GIT",
          "repo": "https://osv-test/repo/url",
          "events": [
            {
              "introduced": "eefe8ec3f1f90d0e684890e810f3f21e8500a4cd"
            },
            {
              "fixed": "8d8242f545e9cec3e6d0d2e3f5bde8be1c659735"
            }
          ]
        }
      ],
      "versions": [
        "branch-v0.1.1"
      ]
    }
  ],
  "references": [
    {
      "type": "WEB",
      "url": "https://ref.com/ref"
    }
  ],
  "database_specific": {
    "specific": 1337
  },
  "severity": [
    {
      "type": "CVSS_V3",
      "score": "CVSS:3.1/AV:N/AC:L/PR:N/UI:N/S:U/C:L/I:L/A:L"
    }
  ],
  "credits": [
    {
      "name": "Foo bar",
      "contact": [
        "mailto:foo@bar.com"
      ]
    }
  ]
}