{
  "id": "CVE-2022-27449",
  "details": "MariaDB Server v10.9 and below was discovered to contain a segmentation fault via the component sql/item_func.cc:148.",
  "affected": [
    {
      "package": {
        "name": "mariadb",
        "ecosystem": "Alpine:v3.12",
        "purl": "pkg:alpine/mariadb"
      },
      "ranges": [
        {
          "type": "ECOSYSTEM",
          "events": [
            {
              "introduced": "0"
            },
            {
              "fixed": "10.4.25-r0"
            }
          ]
        }
      ]
    },
    {
      "package": {
        "name": "mariadb",
        "ecosystem": "Alpine:v3.13",
        "purl": "pkg:alpine/mariadb"
      },
      "ranges": [
        {
          "type": "ECOSYSTEM",
          "events": [
            {
              "introduced": "0"
            },
            {
              "fixed": "10.5.16-r0"
            }
          ]
        }
      ]
    },
    {
      "package": {
        "name": "mariadb",
        "ecosystem": "Alpine:v3.14",
        "purl": "pkg:alpine/mariadb"
      },
      "ranges": [
        {
          "type": "ECOSYSTEM",
          "events": [
            {
              "introduced": "0"
            },
            {
              "fixed": "10.5.16-r0"
            }
          ]
        }
      ]
    },
    {
      "package": {
        "name": "mariadb",
        "ecosystem": "Alpine:v3.15",
        "purl": "pkg:alpine/mariadb"
      },
      "ranges": [
        {
          "type": "ECOSYSTEM",
          "events": [
            {
              "introduced": "0"
            },
            {
              "fixed": "10.6.8-r0"
            }
          ]
        }
      ]
    },
    {
      "package": {
        "name": "mariadb",
        "ecosystem": "Alpine:v3.16",
        "purl": "pkg:alpine/mariadb"
      },
      "ranges": [
        {
          "type": "ECOSYSTEM",
          "events": [
            {
              "introduced": "0"
            },
            {
              "fixed": "10.6.8-r0"
            }
          ]
        }
      ]
    }
  ],
  "references": [
    {
      "type": "EVIDENCE",
      "url": "https://jira.mariadb.org/browse/MDEV-28089"
    },
    {
      "type": "REPORT",
      "url": "https://jira.mariadb.org/browse/MDEV-28089"
    },
    {
      "type": "FIX",
      "url": "https://jira.mariadb.org/browse/MDEV-28089"
    },
    {
      "type": "WEB",
      "url": "https://jira.mariadb.org/browse/MDEV-28089"
    },
    {
      "type": "ADVISORY",
      "url": "https://security.netapp.com/advisory/ntap-20220526-0006/"
    },
    {
      "type": "ARTICLE",
      "url": "https://lists.debian.org/debian-lts-announce/2022/09/msg00023.html"
    },
    {
      "type": "WEB",
      "url": "https://lists.debian.org/debian-lts-announce/2022/09/msg00023.html"
    }
  ],
  "modified": "2022-10-07T18:59:00Z",
  "published": "2022-04-14T13:15:00Z"
}
