{
  "affected": [
    {}
  ],
  "database_specific": {
    "cna_assigner": "redhat",
    "cwe_ids": [
      "CWE-122",
      "CWE-131"
    ],
    "osv_generated_from": "unknown",
    "unresolved_ranges": [
      {
        "metadata": {
          "source": "AFFECTED_FIELD"
        },
        "versions": [
          {
            "last_affected": "7.61.1"
          }
        ]
      },
      {
        "metadata": {
          "source": "DESCRIPTION"
        },
        "versions": [
          {
            "fixed": "7.61.1"
          }
        ]
      }
    ]
  },
  "details": "curl before version 7.61.1 is vulnerable to a buffer overrun in the NTLM authentication code. The internal function Curl_ntlm_core_mk_nt_hash multiplies the length of the password by two (SUM) to figure out how large temporary storage area to allocate from the heap. The length value is then subsequently used to iterate over the password and generate output into the allocated storage buffer. On systems with a 32 bit size_t, the math to calculate SUM triggers an integer overflow when the password length exceeds 2GB (2^31 bytes). This integer overflow usually causes a very small buffer to actually get allocated instead of the intended very huge one, making the use of that buffer end up in a heap buffer overflow. (This bug is almost identical to CVE-2017-8816.)",
  "id": "CVE-2018-14618",
  "modified": "2024-08-05T09:29:51.906Z",
  "published": "2018-09-05T19:00:00Z",
  "references": [
    {
      "type": "ADVISORY",
      "url": "http://www.securitytracker.com/id/1041605"
    },
    {
      "type": "ADVISORY",
      "url": "https://access.redhat.com/errata/RHSA-2018:3558"
    },
    {
      "type": "ADVISORY",
      "url": "https://access.redhat.com/errata/RHSA-2019:1880"
    },
    {
      "type": "REPORT",
      "url": "https://bugzilla.redhat.com/show_bug.cgi?id=CVE-2018-14618"
    },
    {
      "type": "WEB",
      "url": "https://cert-portal.siemens.com/productcert/pdf/ssa-436177.pdf"
    },
    {
      "type": "WEB",
      "url": "https://curl.haxx.se/docs/CVE-2018-14618.html"
    },
    {
      "type": "ADVISORY",
      "url": "https://nvd.nist.gov/vuln/detail/CVE-2018-14618"
    },
    {
      "type": "WEB",
      "url": "https://psirt.global.sonicwall.com/vuln-detail/SNWLID-2018-0014"
    },
    {
      "type": "ADVISORY",
      "url": "https://security.gentoo.org/glsa/201903-03"
    },
    {
      "type": "ADVISORY",
      "url": "https://usn.ubuntu.com/3765-1/"
    },
    {
      "type": "ADVISORY",
      "url": "https://usn.ubuntu.com/3765-2/"
    },
    {
      "type": "ADVISORY",
      "url": "https://www.debian.org/security/2018/dsa-4286"
    }
  ],
  "schema_version": "1.7.3",
  "severity": [
    {
      "score": "CVSS:3.0/AV:N/AC:H/PR:N/UI:R/S:U/C:H/I:H/A:H",
      "type": "CVSS_V3"
    }
  ]
}