{
  "id": "CVE-5",
  "modified": "2025-10-13T15:48:05.022004Z",
  "published": "2023-08-14T00:00:00Z",
  "affected": [
    { "package": { "ecosystem": "Red Hat:rhel_e4s:9.2::appstream", "name": "package1" } },
    { "package": { "ecosystem": "SUSE Linux Enterprise Server:sles:15:sp4::module-containers", "name": "package2" } },
    { "package": { "ecosystem": "Ubuntu:ubuntu_pro:22.04::main", "name": "package3" } },
    { "package": { "ecosystem": "Oracle Linux:ol8_baseos_latest::ol8_baseos_latest", "name": "package4" } },
    { "package": { "ecosystem": "Amazon Linux:amazon_linux_2023::al2023_appstream", "name": "package5" } }
  ]
}

