{
  "affected": [
    {
      "ranges": [
        {
          "database_specific": {
            "cpe": "cpe:2.3:a:libdwarf_project:libdwarf:*:*:*:*:*:*:*:*",
            "source": "CPE_FIELD",
            "versions": [
              {
                "introduced": "0.1.0"
              },
              {
                "fixed": "0.9.2"
              }
            ]
          },
          "events": [
            {
              "introduced": "0"
            },
            {
              "fixed": "5e43a5ab73cb00c8a46660b361366a8c9c3c93c9"
            }
          ],
          "repo": "https://github.com/davea42/libdwarf-code",
          "type": "GIT"
        }
      ]
    }
  ],
  "database_specific": {
    "unresolved_ranges": [
      {
        "metadata": {
          "cpes": [
            "cpe:2.3:o:fedoraproject:fedora:40:*:*:*:*:*:*:*",
            "cpe:2.3:o:redhat:enterprise_linux:7.0:*:*:*:*:*:*:*",
            "cpe:2.3:o:redhat:enterprise_linux:8.0:*:*:*:*:*:*:*"
          ],
          "source": "CPE_FIELD"
        },
        "versions": [
          {
            "last_affected": "7.0"
          },
          {
            "last_affected": "8.0"
          },
          {
            "last_affected": "40"
          }
        ]
      }
    ]
  },
  "details": "A double-free vulnerability was found in libdwarf. In a multiply-corrupted DWARF object, libdwarf may try to dealloc(free) an allocation twice, potentially causing unpredictable and various results.",
  "id": "CVE-2024-2002",
  "modified": "2025-04-09T15:36:37.840Z",
  "published": "2024-03-18T13:15:07.657Z",
  "references": [
    {
      "type": "ADVISORY",
      "url": "https://access.redhat.com/security/cve/CVE-2024-2002"
    },
    {
      "type": "ADVISORY",
      "url": "https://github.com/davea42/libdwarf-code/blob/main/bugxml/data.txt"
    },
    {
      "type": "REPORT",
      "url": "https://bugzilla.redhat.com/show_bug.cgi?id=2267700"
    },
    {
      "type": "ARTICLE",
      "url": "https://lists.fedoraproject.org/archives/list/package-announce@lists.fedoraproject.org/message/ZGPVLSPIXR32J6FOAFTTIMYTUUXJICGW/"
    }
  ],
  "severity": [
    {
      "score": "CVSS:3.1/AV:N/AC:L/PR:N/UI:N/S:U/C:N/I:N/A:H",
      "type": "CVSS_V3"
    }
  ]
}