{
  "affected": [
    {
      "ranges": [
        {
          "database_specific": {
            "source": "AFFECTED_FIELD",
            "versions": [
              {
                "introduced": "0"
              },
              {
                "last_affected": "4.x"
              }
            ]
          },
          "events": [
            {
              "introduced": "0"
            },
            {
              "last_affected": "85c43e41805cde051a7a29aefcac2cd6aee8c69d"
            }
          ],
          "repo": "https://github.com/forcedotcom/salesforcemobilesdk-windows",
          "type": "GIT"
        }
      ]
    }
  ],
  "database_specific": {
    "cna_assigner": "VulDB",
    "cwe_ids": [
      "CWE-89"
    ],
    "osv_generated_from": "unknown"
  },
  "details": "** UNSUPPORTED WHEN ASSIGNED ** A vulnerability was found in forcedotcom SalesforceMobileSDK-Windows up to 4.x. It has been rated as critical. This issue affects the function ComputeCountSql of the file SalesforceSDK/SmartStore/Store/QuerySpec.cs. The manipulation leads to sql injection. Upgrading to version 5.0.0 is able to address this issue. The patch is named 83b3e91e0c1e84873a6d3ca3c5887eb5b4f5a3d8. It is recommended to upgrade the affected component. The associated identifier of this vulnerability is VDB-217619. NOTE: This vulnerability only affects products that are no longer supported by the maintainer.",
  "id": "CVE-2016-15012",
  "modified": "2025-04-08T20:30:50.208Z",
  "published": "2023-01-07T12:59:27.772Z",
  "references": [
    {
      "type": "FIX",
      "url": "https://github.com/forcedotcom/SalesforceMobileSDK-Windows/commit/83b3e91e0c1e84873a6d3ca3c5887eb5b4f5a3d8"
    },
    {
      "type": "FIX",
      "url": "https://github.com/forcedotcom/SalesforceMobileSDK-Windows/releases/tag/v5.0.0"
    },
    {
      "type": "ADVISORY",
      "url": "https://nvd.nist.gov/vuln/detail/CVE-2016-15012"
    },
    {
      "type": "REPORT",
      "url": "https://vuldb.com/?ctiid.217619"
    },
    {
      "type": "ADVISORY",
      "url": "https://vuldb.com/?id.217619"
    }
  ],
  "schema_version": "1.7.3",
  "severity": [
    {
      "score": "CVSS:3.1/AV:A/AC:L/PR:L/UI:N/S:U/C:L/I:L/A:L",
      "type": "CVSS_V3"
    }
  ],
  "summary": "forcedotcom SalesforceMobileSDK-Windows QuerySpec.cs ComputeCountSql sql injection"
}