{
  "affected": [
    {
      "ranges": [
        {
          "database_specific": {
            "source": "AFFECTED_FIELD",
            "versions": [
              {
                "introduced": "0"
              },
              {
                "last_affected": "1.25.3"
              }
            ]
          },
          "events": [
            {
              "introduced": "0"
            },
            {
              "last_affected": "9a7cfd8620989d9de6dc4ca0c95d9fd42c1768ed"
            }
          ],
          "repo": "https://github.com/go-gitea/gitea",
          "type": "GIT"
        }
      ]
    }
  ],
  "aliases": [
    "GHSA-vfmv-f93v-37mw"
  ],
  "database_specific": {
    "cna_assigner": "Gitea",
    "cwe_ids": [
      "CWE-284",
      "CWE-639"
    ],
    "osv_generated_from": "unknown"
  },
  "details": "Gitea does not properly validate repository ownership when linking attachments to releases. An attachment uploaded to a private repository could potentially be linked to a release in a different public repository, making it accessible to unauthorized users.",
  "id": "CVE-2026-20912",
  "modified": "2026-01-23T21:53:41.649Z",
  "published": "2026-01-22T22:01:52.026Z",
  "references": [
    {
      "type": "ADVISORY",
      "url": "https://blog.gitea.com/release-of-1.25.4/"
    },
    {
      "type": "FIX",
      "url": "https://github.com/go-gitea/gitea/pull/36320"
    },
    {
      "type": "FIX",
      "url": "https://github.com/go-gitea/gitea/pull/36355"
    },
    {
      "type": "ADVISORY",
      "url": "https://github.com/go-gitea/gitea/releases/tag/v1.25.4"
    },
    {
      "type": "ADVISORY",
      "url": "https://github.com/go-gitea/gitea/security/advisories/GHSA-vfmv-f93v-37mw"
    },
    {
      "type": "ADVISORY",
      "url": "https://nvd.nist.gov/vuln/detail/CVE-2026-20912"
    }
  ],
  "schema_version": "1.7.3",
  "severity": [
    {
      "score": "CVSS:3.1/AV:N/AC:L/PR:N/UI:N/S:U/C:H/I:H/A:N",
      "type": "CVSS_V3"
    }
  ],
  "summary": "Gitea: Cross-Repository Authorization Bypass via Release Attachment Linking Leads to Private Attachment Disclosure"
}