{
  "affected": [
    {
      "ranges": [
        {
          "database_specific": {
            "cpe": "cpe:2.3:a:google:protobuf-python:*:*:*:*:*:*:*:*",
            "source": [
              "CPE_FIELD",
              "REFERENCES"
            ],
            "versions": [
              {
                "introduced": "0"
              },
              {
                "fixed": "4.25.8"
              },
              {
                "introduced": "5.26.0"
              },
              {
                "fixed": "5.29.5"
              },
              {
                "introduced": "6.30.0"
              },
              {
                "fixed": "6.31.1"
              }
            ]
          },
          "events": [
            {
              "introduced": "0"
            },
            {
              "fixed": "a4cbdd3ed0042e8f9b9c30e8b0634096d9532809"
            },
            {
              "introduced": "d6511091a0cab1ad13f676a02676ad2a0e5eb9ae"
            },
            {
              "fixed": "f5de0a0495faa63b4186fc767324f8b9a7bf4fc4"
            },
            {
              "introduced": "d295af5c3002c08e1bfd9d7f9e175d0a4d015f1e"
            },
            {
              "fixed": "74211c0dfc2777318ab53c2cd2c317a2ef9012de"
            },
            {
              "fixed": "17838beda2943d08b8a9d4df5b68f5f04f26d901"
            }
          ],
          "repo": "https://github.com/protocolbuffers/protobuf",
          "type": "GIT"
        }
      ]
    }
  ],
  "database_specific": {},
  "details": "Any project that uses Protobuf Pure-Python backend to parse untrusted Protocol Buffers data containing an arbitrary number of recursive groups, recursive messages or a series of SGROUP tags can be corrupted by exceeding the Python recursion limit. This can result in a Denial of service by crashing the application with a RecursionError. We recommend upgrading to version =\u003e6.31.1 or beyond commit 17838beda2943d08b8a9d4df5b68f5f04f26d901",
  "id": "CVE-2025-4565",
  "modified": "2025-08-14T17:05:37.770Z",
  "published": "2025-06-16T15:15:24.990Z",
  "references": [
    {
      "type": "FIX",
      "url": "https://github.com/protocolbuffers/protobuf/commit/17838beda2943d08b8a9d4df5b68f5f04f26d901"
    }
  ],
  "severity": [
    {
      "score": "CVSS:3.1/AV:N/AC:L/PR:N/UI:N/S:U/C:N/I:N/A:L",
      "type": "CVSS_V3"
    }
  ]
}