{
  "id": "CVE-2021-44228",
  "modified": "2025-02-04T00:00:00Z",
  "published": "2023-08-14T00:00:00Z",
  "summary": "Log4Shell demo entry",
  "severity": [
    {
      "type": "CVSS_V3",
      "score": "CVSS:3.1/AV:N/AC:L/PR:N/UI:N/S:U/C:H/I:H/A:H",
      "source": "NVD"
    }
  ],
  "affected": []
}

