{
  "affected": [
    {
      "ranges": [
        {
          "database_specific": {
            "cpe": "cpe:2.3:a:harfbuzz_project:harfbuzz:4.3.0:*:*:*:*:*:*:*",
            "source": [
              "CPE_FIELD",
              "REFERENCES"
            ],
            "versions": [
              {
                "introduced": "0"
              },
              {
                "last_affected": "4.3.0"
              }
            ]
          },
          "events": [
            {
              "introduced": "0"
            },
            {
              "last_affected": "aee123fc83388b8f5acfb301d87bd92eccc5b843"
            },
            {
              "fixed": "62e803b36173fd096d7ad460dd1d1db9be542593"
            }
          ],
          "repo": "https://github.com/harfbuzz/harfbuzz",
          "type": "GIT"
        }
      ]
    }
  ],
  "database_specific": {
    "unresolved_ranges": [
      {
        "metadata": {
          "cpes": [
            "cpe:2.3:o:fedoraproject:fedora:35:*:*:*:*:*:*:*",
            "cpe:2.3:o:fedoraproject:fedora:36:*:*:*:*:*:*:*"
          ],
          "source": "CPE_FIELD"
        },
        "versions": [
          {
            "last_affected": "35"
          },
          {
            "last_affected": "36"
          }
        ]
      }
    ]
  },
  "details": "An integer overflow in the component hb-ot-shape-fallback.cc of Harfbuzz v4.3.0 allows attackers to cause a Denial of Service (DoS) via unspecified vectors.",
  "id": "CVE-2022-33068",
  "modified": "2024-11-21T07:07:30.140Z",
  "published": "2022-06-23T17:15:14.350Z",
  "references": [
    {
      "type": "WEB",
      "url": "https://lists.fedoraproject.org/archives/list/package-announce%40lists.fedoraproject.org/message/FQBJ24W6TXLSAQWCFW7IBGUMX4AJI3S4/"
    },
    {
      "type": "WEB",
      "url": "https://lists.fedoraproject.org/archives/list/package-announce%40lists.fedoraproject.org/message/QQMEXOVDL3T2UXKBCON7JSOCE646G7HG/"
    },
    {
      "type": "WEB",
      "url": "https://lists.fedoraproject.org/archives/list/package-announce%40lists.fedoraproject.org/message/W56WTC5IY4EIUHVUIHMCXA3BSBZLSZCI/"
    },
    {
      "type": "ADVISORY",
      "url": "https://security.gentoo.org/glsa/202209-11"
    },
    {
      "type": "FIX",
      "url": "https://github.com/harfbuzz/harfbuzz/commit/62e803b36173fd096d7ad460dd1d1db9be542593"
    },
    {
      "type": "FIX",
      "url": "https://github.com/harfbuzz/harfbuzz/issues/3557"
    }
  ],
  "severity": [
    {
      "score": "CVSS:3.1/AV:L/AC:L/PR:N/UI:R/S:U/C:N/I:N/A:H",
      "type": "CVSS_V3"
    }
  ]
}